{
  "contract_version": "mq-id-input.v1",
  "case_name": "synthetic-100",
  "batch_input": {
    "sheets": [
      {
        "name": "Batch_Input",
        "rows": [
          [
            "Synthetic MQ Batch Input"
          ],
          [
            "MQ_ID"
          ],
          [
            "MQ-0001"
          ],
          [
            "MQ-0002"
          ],
          [
            "MQ-0003"
          ],
          [
            "MQ-0004"
          ],
          [
            "MQ-0005"
          ],
          [
            "MQ-0006"
          ],
          [
            "MQ-0007"
          ],
          [
            "MQ-0008"
          ],
          [
            "MQ-0009"
          ],
          [
            "MQ-0010"
          ],
          [
            "MQ-0011"
          ],
          [
            "MQ-0012"
          ],
          [
            "MQ-0013"
          ],
          [
            "MQ-0014"
          ],
          [
            "MQ-0015"
          ],
          [
            "MQ-0016"
          ],
          [
            "MQ-0017"
          ],
          [
            "MQ-0018"
          ],
          [
            "MQ-0019"
          ],
          [
            "MQ-0020"
          ],
          [
            "MQ-0021"
          ],
          [
            "MQ-0022"
          ],
          [
            "MQ-0023"
          ],
          [
            "MQ-0024"
          ],
          [
            "MQ-0025"
          ],
          [
            "MQ-0026"
          ],
          [
            "MQ-0027"
          ],
          [
            "MQ-0028"
          ],
          [
            "MQ-0029"
          ],
          [
            "MQ-0030"
          ],
          [
            "MQ-0031"
          ],
          [
            "MQ-0032"
          ],
          [
            "MQ-0033"
          ],
          [
            "MQ-0034"
          ],
          [
            "MQ-0035"
          ],
          [
            "MQ-0036"
          ],
          [
            "MQ-0037"
          ],
          [
            "MQ-0038"
          ],
          [
            "MQ-0039"
          ],
          [
            "MQ-0040"
          ],
          [
            "MQ-0041"
          ],
          [
            "MQ-0042"
          ],
          [
            "MQ-0043"
          ],
          [
            "MQ-0044"
          ],
          [
            "MQ-0045"
          ],
          [
            "MQ-0046"
          ],
          [
            "MQ-0047"
          ],
          [
            "MQ-0048"
          ],
          [
            "MQ-0049"
          ],
          [
            "MQ-0050"
          ],
          [
            "MQ-0051"
          ],
          [
            "MQ-0052"
          ],
          [
            "MQ-0053"
          ],
          [
            "MQ-0054"
          ],
          [
            "MQ-0055"
          ],
          [
            "MQ-0056"
          ],
          [
            "MQ-0057"
          ],
          [
            "MQ-0058"
          ],
          [
            "MQ-0059"
          ],
          [
            "MQ-0060"
          ],
          [
            "MQ-0061"
          ],
          [
            "MQ-0062"
          ],
          [
            "MQ-0063"
          ],
          [
            "MQ-0064"
          ],
          [
            "MQ-0065"
          ],
          [
            "MQ-0066"
          ],
          [
            "MQ-0067"
          ],
          [
            "MQ-0068"
          ],
          [
            "MQ-0069"
          ],
          [
            "MQ-0070"
          ],
          [
            "MQ-0071"
          ],
          [
            "MQ-0072"
          ],
          [
            "MQ-0073"
          ],
          [
            "MQ-0074"
          ],
          [
            "MQ-0075"
          ],
          [
            "MQ-0076"
          ],
          [
            "MQ-0077"
          ],
          [
            "MQ-0078"
          ],
          [
            "MQ-0079"
          ],
          [
            "MQ-0080"
          ],
          [
            "MQ-0081"
          ],
          [
            "MQ-0082"
          ],
          [
            "MQ-0083"
          ],
          [
            "MQ-0084"
          ],
          [
            "MQ-0085"
          ],
          [
            "MQ-0086"
          ],
          [
            "MQ-0087"
          ],
          [
            "MQ-0088"
          ],
          [
            "MQ-0089"
          ],
          [
            "MQ-0090"
          ],
          [
            "MQ-0091"
          ],
          [
            "MQ-0092"
          ],
          [
            "MQ-0093"
          ],
          [
            "MQ-0094"
          ],
          [
            "MQ-0095"
          ],
          [
            "MQ-0096"
          ],
          [
            "MQ-0097"
          ],
          [
            "MQ-0098"
          ],
          [
            "MQ-0099"
          ],
          [
            "MQ-0100"
          ]
        ]
      }
    ]
  },
  "log_text": "Synthetic log; fictional data only.\nMQ_BOX_ID=MQ-0001\nMQ_BOX_ID=MQ-0002\nMQ_BOX_ID=MQ-0003\nMQ_BOX_ID=MQ-0004\nMQ_BOX_ID=MQ-0005\nMQ_BOX_ID=MQ-0006\nMQ_BOX_ID=MQ-0007\nMQ_BOX_ID=MQ-0008\nMQ_BOX_ID=MQ-0009\nMQ_BOX_ID=MQ-0010\nMQ_BOX_ID=MQ-0011\nMQ_BOX_ID=MQ-0012\nMQ_BOX_ID=MQ-0013\nMQ_BOX_ID=MQ-0014\nMQ_BOX_ID=MQ-0015\nMQ_BOX_ID=MQ-0016\nMQ_BOX_ID=MQ-0017\nMQ_BOX_ID=MQ-0018\nMQ_BOX_ID=MQ-0019\nMQ_BOX_ID=MQ-0020\nMQ_BOX_ID=MQ-0021\nMQ_BOX_ID=MQ-0022\nMQ_BOX_ID=MQ-0023\nMQ_BOX_ID=MQ-0024\nMQ_BOX_ID=MQ-0025\nMQ_BOX_ID=MQ-0026\nMQ_BOX_ID=MQ-0027\nMQ_BOX_ID=MQ-0028\nMQ_BOX_ID=MQ-0029\nMQ_BOX_ID=MQ-0030\nMQ_BOX_ID=MQ-0031\nMQ_BOX_ID=MQ-0032\nMQ_BOX_ID=MQ-0033\nMQ_BOX_ID=MQ-0034\nMQ_BOX_ID=MQ-0035\nMQ_BOX_ID=MQ-0036\nMQ_BOX_ID=MQ-0037\nMQ_BOX_ID=MQ-0038\nMQ_BOX_ID=MQ-0039\nMQ_BOX_ID=MQ-0040\nMQ_BOX_ID=MQ-0041\nMQ_BOX_ID=MQ-0042\nMQ_BOX_ID=MQ-0043\nMQ_BOX_ID=MQ-0044\nMQ_BOX_ID=MQ-0045\nMQ_BOX_ID=MQ-0046\nMQ_BOX_ID=MQ-0047\nMQ_BOX_ID=MQ-0048\nMQ_BOX_ID=MQ-0049\nMQ_BOX_ID=MQ-0051\nMQ_BOX_ID=MQ-0052\nMQ_BOX_ID=MQ-0053\nMQ_BOX_ID=MQ-0054\nMQ_BOX_ID=MQ-0055\nMQ_BOX_ID=MQ-0056\nMQ_BOX_ID=MQ-0057\nMQ_BOX_ID=MQ-0058\nMQ_BOX_ID=MQ-0059\nMQ_BOX_ID=MQ-0060\nMQ_BOX_ID=MQ-0061\nMQ_BOX_ID=MQ-0062\nMQ_BOX_ID=MQ-0063\nMQ_BOX_ID=MQ-0064\nMQ_BOX_ID=MQ-0065\nMQ_BOX_ID=MQ-0066\nMQ_BOX_ID=MQ-0067\nMQ_BOX_ID=MQ-0068\nMQ_BOX_ID=MQ-0069\nMQ_BOX_ID=MQ-0070\nMQ_BOX_ID=MQ-0071\nMQ_BOX_ID=MQ-0072\nMQ_BOX_ID=MQ-0073\nMQ_BOX_ID=MQ-0074\nMQ_BOX_ID=MQ-0075\nMQ_BOX_ID=MQ-0076\nMQ_BOX_ID=MQ-0077\nMQ_BOX_ID=MQ-0078\nMQ_BOX_ID=MQ-0079\nMQ_BOX_ID=MQ-0080\nMQ_BOX_ID=MQ-0081\nMQ_BOX_ID=MQ-0082\nMQ_BOX_ID=MQ-0083\nMQ_BOX_ID=MQ-0084\nMQ_BOX_ID=MQ-0085\nMQ_BOX_ID=MQ-0086\nMQ_BOX_ID=MQ-0087\nMQ_BOX_ID=MQ-0088\nMQ_BOX_ID=MQ-0089\nMQ_BOX_ID=MQ-0090\nMQ_BOX_ID=MQ-0091\nMQ_BOX_ID=MQ-0092\nMQ_BOX_ID=MQ-0093\nMQ_BOX_ID=MQ-0094\nMQ_BOX_ID=MQ-0095\nMQ_BOX_ID=MQ-0096\nMQ_BOX_ID=MQ-0097\nMQ_BOX_ID=MQ-0098\nMQ_BOX_ID=MQ-0099\nMQ_BOX_ID=MQ-0100\nMQ_BOX_ID=MQ-9001\nALL SUCCESS\n"
}
